"CKWZQFRH","conferencePaper","2022","Marwane, Bensaad; Elmiloud, Chaabelasri","Numerical solution by meshless method of a fully-coupled bed load and shallow water flows","E3S Web of Conferences","","","","","The one-dimensional shallow water equations (SWEs), coupled with bed load (Exner equation) were solved in this paper for the numerical simulation of the sediment transport problem. By using an efficient meshless method based on radial basis function (RBF) that approximates the unknown variables on a set of collocation nodes and Runge–Kutta fourth-order scheme to approximate the temporal derivative. Besides, the artificial viscosity to avoid oscillations, we implement the proposed numerical model of bedload and set up a series of numerical tests using various nontrivial solutions to confirm the efficiency of the suggested approaches. The numerical simulations demonstrate the accuracy, computational efficiency, and ability of the suggested numerical methods in solving the coupled Exner shallow water problem.","2022","2024-11-21 21:48:33","2024-11-21 21:56:22","","00003","","","336","","","","","","","","EDP Sciences","","","","","","","","","","","","","","","","","","","","","","","","","","","","","","","","","","","","","","","","","","","","","","","","","","","","","","","","","","","",""
"NET69L49","journalArticle","2010","Ancey, Christophe","Stochastic modeling in sediment dynamics: Exner equation for planar bed incipient bed load transport conditions","Journal of Geophysical Research: Earth Surface","","","","","Even under flow equilibrium conditions, river bed topography continuously evolves with time, producing trains of irregular bed forms. The idea has recently emerged that the variability in the bed form geometry results from some randomness in sediment flux. In this paper, we address this issue by using the Exner equation and a population exchange model derived in an earlier paper. In this model, particle entrainment and deposition are idealized as population exchanges between the stream and the bed, which makes it possible to use birth-death Markov process theory to track the number of moving grains. The paper focuses on nascent bed forms on initially planar beds, a situation in which the coupling between the stream and bed is weak. In a steady state, the number of moving particles follows a negative binomial distribution. Although this probability distribution does not enter the family of heavy-tailed distributions, it may give rise to large and frequent fluctuations because the standard deviation can be much larger than the mean, a feature that is not accounted for with classic probability laws (e.g., Hamamori's law) used so far for describing bed load fluctuations. In the large-system limit, the master equation of the birth-death Markov process can be transformed into a Fokker-Planck equation. This transformation is used here to show that the number of moving particles can be described as an Ornstein-Uhlenbeck process. An important consequence is that in the long term, the number of moving particles follows a Gaussian distribution. Laboratory experiments show that this approximation is correct when the mean number per unit length of stream, equation image/L, is sufficiently large (typically two particles per centimeter in our experiments). The particle number fluctuations give rise to bed elevation fluctuations, whose spectrum falls off like ω−2 in the high-frequency regime (with ω the angular frequency) and variance grows linearly with time. These features are in agreement with recent observations on bed form development (in particular, ripple growth).","2010","2024-11-21 21:48:33","2024-11-21 22:08:32","","","","F2","115","","","","","","","","","","","","","","","","","Publisher: Wiley Online Library","","","","","","","","","","","","","","","","","","","","","","","","","","","","","","","","","","","","","","","","","","","","","","","","","","",""
"EVSVWPJY","journalArticle","2015","Audusse, Emmanuel; Boyaval, Sébastien; Goutal, Nicole; Jodeau, Magali; Ung, Philippe","Numerical simulation of the dynamics of sedimentary river beds with a stochastic Exner equation","ESAIM: Proceedings and Surveys","","","","","At the scale of a river reach, the dynamics of the river bed is typically modelled by Exner equation (conservation of the solid mass) with an empirical solid flux of transported sediments, which is a simple deterministic algebraic formula function of i) the sediment physical characteristics (size and mass) and of ii) the averaged hydrodynamical description of the ambient water flow. This model has proved useful, in particular through numerical simulations, for hydraulic engineering purposes (like estimating the mass of sediments that is drained through an open dam). Though, the model is also coarse. And its applicability at various space and time scales remains a question of considerable interest for sedimentologists. In particular, physical experiments from the grain scale to the laboratory scale reveal important fluctuations of the solid flux in given hydrodynamical conditions. This work is a preliminary study of the coupling of a stochastic Exner equation with a hydrody-namical model for large scales. (Stochastic models with a probabilistic solid flux are currently being investigated, but most often only from the viewpoint of theoretical physics at the grain scale.) We introduce a new stochastic Exner model and discuss it using numerical simulations in an appropriate test case.","2015","2024-11-21 21:48:33","2024-11-21 22:02:17","","321–340","","","48","","","","","","","","","","","","","","","","","Publisher: EDP Sciences","","","","","","","","","","","","","","","","","","","","","","","","","","","","","","","","","","","","","","","","","","","","","","","","","","",""
"64RAGPU3","journalArticle","2017","Liu, Xin; Beljadid, Abdelaziz","A coupled numerical model for water flow, sediment transport and bed erosion","Computers & Fluids","","","","","In this paper, we propose an accurate Riemann-solver free method for a coupled system modeling shallow water flows, sediment transport and rapid bed erosion. The hydrodynamic model solving shallow water equations (SWEs) is coupled with the sediment transport equation and the morphodynamic model. A Godunov-type central-upwind scheme is proposed to numerically solve the resulting system based on the technique that using two different pairs of local wave speeds to estimate numerical fluxes for hydrodynamic and morphodynamic models, respectively. The proposed technique leads to accurate results for the computation of the morphodynamic model. The proposed scheme is based on computationally efficient techniques and do not require analytical expressions of the eingenstructure of the system. A well-balanced discretization of the bed-slope terms is developed in framework of the coupling approach. Finally, we demonstrate the robustness and accuracy of the proposed numerical scheme for the coupled system using several numerical tests.","2017","2024-11-21 21:48:33","2024-11-21 22:00:28","","273–284","","","154","","","","","","","","","","","","","","","","","Publisher: Elsevier","","","","","","","","","","","","","","","","","","","","","","","","","","","","","","","","","","","","","","","","","","","","","","","","","","",""
"82X6GZXU","journalArticle","2007","Kubatko, Ethan J; Westerink, Joannes J","Exact discontinuous solutions of Exner’s bed evolution model: Simple theory for sediment bores","Journal of hydraulic engineering","","","","","Determining the evolution of the bed of a river or channel due to the transport of sediment was first examined in a theoretical context by Exner in 1925. In his work, Exner presents a simplified bed evolution model derived from the conservation of fluid mass and an “erosion” equation that is commonly referred to as the sediment continuity or Exner equation. Given that Exner’s model takes the form of a nonlinear hyperbolic equation, one expects, depending on the given initial condition of the bed, the formation of discontinuities in the solution in finite time. The analytical solution provided by Exner for his model is the so-called classical or genuine solution of the initial-value problem, which is valid while the solution is continuous. In this paper, using the general theory of nonlinear hyperbolic equations, we consider generalized solutions of Exner’s classic bed evolution model thereby developing a simple theory for the formation and propagation of discontinuities in the bed or so-called sediment bores.","2007","2024-11-21 21:48:33","2024-11-21 22:08:57","","305–311","","3","133","","","","","","","","","","","","","","","","","Publisher: American Society of Civil Engineers","","","","","","","","","","","","","","","","","","","","","","","","","","","","","","","","","","","","","","","","","","","","","","","","","","",""
"7NLM7Q3V","journalArticle","2011","Cordier, Stéphane; Le, Minh H; De Luna, T Morales","Bedload transport in shallow water models: Why splitting (may) fail, how hyperbolicity (can) help","Advances in Water Resources","","","","","In this paper, we are concerned with sediment transport models consisting of a shallow water system coupled with the so called Exner equation to describe the evolution of the topography. We show that, for some bedload transport models like the well-known Meyer-Peter and Müller model, the system is hyperbolic and, thus, linearly stable, only under some constraint on the velocity. In practical situations, this condition is hopefully fulfilled. Numerical approximations of such system are often based on a splitting method, solving first shallow water equation on a time step and, updating afterwards the topography. It is shown that this strategy can create spurious/unphysical oscillations which are related to the study of hyperbolicity. Using an upper bound of the largest eigenvector may improve the results although the instabilities cannot be always avoided, e.g. in supercritical regions.","2011","2024-11-21 21:48:33","2024-11-21 22:02:48","","980–989","","8","34","","","","","","","","","","","","","","","","","Publisher: Elsevier","","","","","","","","","","","","","","","","","","","","","","","","","","","","","","","","","","","","","","","","","","","","","","","","","","",""
"A9P7F8Z2","journalArticle","2015","Peng, Szu-Hsien; Tang, Chuan","Development and application of two-dimensional numerical model on shallow water flows using finite volume method","Journal of Applied Mathematics and Physics","","","","","This present study develops a 2-D numerical scheme to simulate the velocity and depth on the actual terrain by using shallow water equations. The computational approach uses the HLL scheme as a basic building block, treats the bottom slope by lateralizing the momentum flux, then refines the scheme using the Strang splitting to deal with the frictional source term. Besides, a decoupled algorithm is also adopted to compute the aggradation and degradation of bed-level elevation by using the Manning-Strickler formula and Exner’s relationship. The main purpose is to set up the window interface of 2-D numerical model and increase the realization of engineers on these characteristics of hydraulic treatment and maintenance.","2015","2024-11-21 21:48:33","2024-11-21 22:01:38","","989–996","","8","3","","","","","","","","","","","","","","","","","Publisher: Scientific Research Publishing","","","","","","","","","","","","","","","","","","","","","","","","","","","","","","","","","","","","","","","","","","","","","","","","","","",""
"5ZKK672A","journalArticle","2016","Rehman, Khawar; Cho, Yong-Sik","Bed evolution under rapidly varying flows by a new method for wave speed estimation","Water","","","","","This paper proposes a sediment-transport model based on coupled Saint-Venant and Exner equations. A finite volume method of Godunov type with predictor-corrector steps is used to solve a set of coupled equations. An efficient combination of approximate Riemann solvers is proposed to compute fluxes associated with sediment-laden flow. In addition, a new method is proposed for computing the water depth and velocity values along the shear wave. This method ensures smooth solutions, even for flows with high discontinuities, and on domains with highly distorted grids. The numerical model is tested for channel aggradation on a sloping bottom, dam-break cases at flume-scale and reach-scale with flat bottom configurations and varying downstream water depths. The proposed model is tested for predicting the position of hydraulic jump, wave front propagation, and for predicting magnitude of bed erosion. The comparison between results based on the proposed scheme and analytical, experimental, and published numerical results shows good agreement. Sensitivity analysis shows that the model is computationally efficient and virtually independent of mesh refinement.","2016","2024-11-21 21:48:33","2024-11-21 22:00:57","","212","","5","8","","","","","","","","","","","","","","","","","Publisher: MDPI","","","","","","","","","","","","","","","","","","","","","","","","","","","","","","","","","","","","","","","","","","","","","","","","","","",""