"NUBMDVDI","journalArticle","2008","Liu, X.; Landry, B.J.; García, M.H.","Two-dimensional scour simulations based on coupled model of shallow water equations and sediment transport on unstructured meshes","Coastal Engineering","","03783839","10.1016/j.coastaleng.2008.02.012","https://www.scopus.com/inward/record.uri?eid=2-s2.0-51749098788&doi=10.1016%2fj.coastaleng.2008.02.012&partnerID=40&md5=6aeb7dd26a9d7d1f97d691d6375d8253","A two-dimensional scour model based on coupled system of shallow water equations (SWEs) and sediment transport on unstructured mesh is developed. The coupled system of hydrodynamic and morphodynamic equations is solved by finite volume method using Godunov scheme. Roe's approximate Riemann solver is used to calculate the inviscid fluxes. The use of unstructured mesh makes the model applicable to complex domains. However, it is difficult to evaluate the eigenvalues and eigenvectors of the Jacobian matrix in the global coordinate. The method proposed herein to deal with this difficulty is to transform the system into the local coordinate with one of the axes in the same direction as the interface outward normal vector. In the local coordinate system, the Jacobian matrix is simplified and the eigenvalues are analyzed using asymptotic method. Regular expansion breaks down when the flow is near critical. Uniformity of the expansion is achieved by changing the scales. Rotational invariance theorem is used to relate the interfacial fluxes in the global and local coordinate systems. Special treatment of the source term on unstructured grid makes the scheme stable and physically balanced (both mass and momentum). The method proposed in this paper for the eigen-system is very efficient comparing to iterative numerical methods. Results from the test cases show good agreement with the experiments. © 2008 Elsevier B.V. All rights reserved.","2008","2024-11-21 20:41:53","2024-11-21 21:49:46","","800-810","","10","55","","","","","","","","","","English","","","","","","","","","","","2D; Computer networks; Coordinate measuring machines; Coupled solver; eigenvalue; Erosion; finite volume method; Fluid dynamics; Fluid mechanics; Godunov scheme; hydrodynamics; Iterative methods; Matrix algebra; Mesh generation; morphodynamics; Numerical analysis; Numerical Method; Numerical methods; numerical model; Ocean Modeling; scour; sediment transport; Sediment transport; Sedimentation; Sedimentology; Shallow water equations; shallow-water equation; Soil mechanics; SWE-Exner; Two dimensional; Two phase flow; Unstructured mesh; Unstructured meshes","","","","","","","","","","","","","","","","","","","","","","","","","","","","","","","","","","","","","","","","","","","","","","",""
"MRNTYXZB","conferencePaper","2019","Lobma, Fadhil; Gunawan, P. H.","Computing UDCHR Scheme for simulating underwater sediment movement using OpenMP","2019 7th International Conference on Information and Communication Technology (ICoICT)","","","10.1109/ICoICT.2019.8835311","","Parallel computing with OpenMP platform in numerical simulation of underwater sediment movement is elaborated. The result shown computer I with processor type Intel Core i7-7500U has better speedup performance ( 3.291493 times of serial computing) than Computer II with processor type AMD Ryzen 5 2400G. Meanwhile, using computer II, the speedup of parallel computing is obtained 3.751561 times of serial computing. Indeed this discrepancy occurs because of the processor type of Computer I is higher than Computer II. Moreover, the efficiency of Computer II is 11.5% lower than computer II which is conducted 91.1367% efficiency. This means using Computer II the ability of parallel codes to achieve best performance proportional to the number of processor is obtained. Furthermore, the numerical simulation using UDCHR is shown in a good agreement with the staggered grid scheme of two-layer SWE and SWE-Exner model.","2019-07","2024-11-21 21:03:51","2024-11-21 21:49:04","","1-5","","","","","","","","","","","","","","","","","","","","","","","","1D; Application programming interfaces (API); Computational modeling; Efficiency; high performance computing; High performance computing; HPC; Mathematical model; Numerical Method; Numerical models; Numerical simulation; OpenMP; Parallel processing; Parallel processing systems; River simulation; sediment movement; Sediment movement; Sediments; simulation; Simulation; Simulation platform; Surfaces; SWE-Exner; Upwinding; Upwinding dispersive correction hydrostatic reconstruction","","","","","","","","","","","","","","","","","","","","","","","","","","","","","","","","","","","","","","","","","","","","","","",""
"UPVH9SVA","journalArticle","2013","Benkhaldoun, Fayssal; Elmahi, Imad; Sari, Saida; Seaid, Mohammed","An unstructured finite-volume method for coupled models of suspended sediment and bed load transport in shallow-water flows","International Journal for Numerical Methods in Fluids","","10970363","10.1002/fld.3771","https://www.scopus.com/inward/record.uri?eid=2-s2.0-84878927349&doi=10.1002%2ffld.3771&partnerID=40&md5=90d64355e3eed0b4bb1d1036b49018e1","The aim of this work is to develop a well-balanced finite-volume method for the accurate numerical solution of the equations governing suspended sediment and bed load transport in two-dimensional shallow-water flows. The modelling system consists of three coupled model components: (i) the shallow-water equations for the hydrodynamical model; (ii) a transport equation for the dispersion of suspended sediments; and (iii) an Exner equation for the morphodynamics. These coupled models form a hyperbolic system of conservation laws with source terms. The proposed finite-volume method consists of a predictor stage for the discretization of gradient terms and a corrector stage for the treatment of source terms. The gradient fluxes are discretized using a modified Roe's scheme using the sign of the Jacobian matrix in the coupled system. A well-balanced discretization is used for the treatment of source terms. In this paper, we also employ an adaptive procedure in the finite-volume method by monitoring the concentration of suspended sediments in the computational domain during its transport process. The method uses unstructured meshes and incorporates upwinded numerical fluxes and slope limiters to provide sharp resolution of steep sediment concentrations and bed load gradients that may form in the approximate solutions. Details are given on the implementation of the method, and numerical results are presented for two idealized test cases, which demonstrate the accuracy and robustness of the method and its applicability in predicting dam-break flows over erodible sediment beds. The method is also applied to a sediment transport problem in the Nador lagoon. © 2013 John Wiley & Sons, Ltd.","2013","2024-11-21 21:06:47","2024-11-21 21:49:35","","967 – 993","","9","72","","","","","","","","","","English","","","","","","","Type: Article","","","","2D; bed load transport; Bed-load transport; Equations of motion; Finite volume method; finite-volume method; Flow of water; FVM; Hydraulics; Jacobian matrices; Lakes; mesh adaptation; Mesh adaptation; Nador lagoon; Numerical Method; Numerical methods; Sediment transport; Sedimentology; Shallow water equations; shallow-water equations; suspended sediment; Suspended sediments; SWE-Exner; Unstructured grid; unstructured grids","","","","","","","","","","","","","","","","","","","","","","","","","","","","","","","","","","","","","","","","","","","","","","",""
"77P7G9WB","journalArticle","2012","Serrano-Pacheco, Alberto; Murillo, Javier; Garcia-Navarro, Pilar","Finite volumes for 2D shallow-water flow with bed-load transport on unstructured grids","Journal of Hydraulic Research","","00221686","10.1080/00221686.2012.669142","https://www.scopus.com/inward/record.uri?eid=2-s2.0-84859706002&doi=10.1080%2f00221686.2012.669142&partnerID=40&md5=c5f71128ca84ee05baf2213e250b2738","In this work, two-dimensional (2D) bed-load transport simulations based on the depth-averaged shallow-water equations and the Exner equation are presented. The Exner equation is written assuming that bed-load transport is governed by a power law of the depth-averaged flow velocity and by a flow/sediment interaction parameter acting as a calibration coefficient. Uncoupled and coupled numerical resolutions of the global problem are considered. A Roe-type first-order upwind scheme has been applied as approximate Riemann solver for the discretization on 2D unstructured meshes. The uncoupled resolution is presented as a simple extension of a previous 2D shallow-water model. The details of the new implementation in the coupled system problem are provided. The models are tested comparing with exact solutions of 2D cases as well as experimental laboratory data. Copyright © 2012 International Association for Hydro-Environment Engineering and Research.","2012","2024-11-21 21:06:47","2024-11-21 21:49:37","","154 – 163","","2","50","","","","","","","","","","English","","","","","","","Type: Article","","","","2D; Bed-load transport; bedload; calibration; data set; Equations of motion; Exner equation; finite volume method; flow velocity; FVM; Grass model; Grass models; Hydraulics; Numerical Method; numerical model; power law; sediment-water interface; Shallow-water; shallow-water equation; shallow-water system; SWE-Exner; Technology; two-dimensional flow; unstructured grid; Unstructured grid; Validation Methods; water flow","","","","","","","","","","","","","","","","","","","","","","","","","","","","","","","","","","","","","","","","","","","","","","",""
"YX7JYRRW","journalArticle","2015","Liu, Xin; Infante Sedano, Julio Ángel; Mohammadian, Abdolmajid","A coupled two-dimensional numerical model for rapidly varying flow, sediment transport and bed morphology","Journal of Hydraulic Research","","00221686","10.1080/00221686.2015.1085919","https://www.scopus.com/inward/record.uri?eid=2-s2.0-84945161951&doi=10.1080%2f00221686.2015.1085919&partnerID=40&md5=ab9ef7953fb21ba153d4df949f6480d3","This paper presents a coupled two-dimensional model that can produce a more stable numerical simulation of rapid bed evolution than the conventional decoupled model. To solve the coupled bed-load sediment transport terms using a Godunov-type central-upwind method, a novel scheme to estimate the bed-load fluxes which can produce more accurate results than the previously reported coupled model is proposed using a pair of local wave speeds different from those used for the flow. The two-dimensional shallow water equations are used to solve the flow velocities and water depth. The bed level is solved by an Exner-based equation containing bed-load sediment transport as numerical flux terms and sediment entrainment and deposition as source terms. Analytical formulas to compute the eigenvalues of the Jacobian matrix are developed. The linear reconstruction of variables with a multi-dimensional slope limiter, and the second-order Runge-Kutta scheme are employed to achieve higher accuracy in space and time. For the case of rapid bed-erosion, the accuracy and stability of the proposed coupled model are verified by several numerical tests. © 2015 International Association for Hydro-Environment Engineering and Research.","2015","2024-11-21 21:06:47","2024-11-21 21:49:29","","609 – 621","","5","53","","","","","","","","","","English","","","","","","","Publisher: Taylor and Francis Ltd. Type: Article","","","","2D; Bed-load transport; bedform; bedload; Coupled modeling; Direct numerical simulation; eigenvalue; Eigenvalues and eigenfunctions; entrainment; Equations of motion; finite volume method; Finite volume method; FVM; Jacobian matrices; Linear reconstruction; Numerical Method; Numerical methods; numerical model; Numerical models; Runge Kutta methods; Sediment entrainments; sediment transport; Sediment transport; Sedimentation; Shallow flow; shallow water; SWE-Exner; Two dimensional model; Two dimensional numerical models; two-dimensional modeling; Two-dimensional shallow water equations; water depth; wave velocity; wind erosion","","","","","","","","","","","","","","","","","","","","","","","","","","","","","","","","","","","","","","","","","","","","","","",""
"RS22ZRLQ","journalArticle","2020","Rowan, Thomas; Seaid, Mohammed","Two-dimensional numerical modelling of shallow water flows over multilayer movable beds","Applied Mathematical Modelling","","0307904X","10.1016/j.apm.2020.06.052","https://www.scopus.com/inward/record.uri?eid=2-s2.0-85088135950&doi=10.1016%2fj.apm.2020.06.052&partnerID=40&md5=b3cb32181ef523ba52b7780c728bdf5b","The two-dimensional modelling of shallow water flows over multi-sediment erodible beds is presented. A novel approach is developed for the treatment of multiple sediment types in morphodynamics. The governing equations include the two-dimensional shallow water equations for hydrodynamics, an Exner-type equation for morphodynamics, a two-dimensional transport equation for the suspended sediments, and a set of empirical equations for entrainment and deposition. Multilayer sedimentary beds are formed of different erodible soils with sediment properties and new exchange conditions between the bed layers are developed for the model. The coupled equations yield a hyperbolic system of balance laws with source terms. As a numerical solver for the system, we implement a fast finite volume characteristics method. The numerical fluxes are reconstructed using the method of characteristics which employs projection techniques. The proposed finite volume solver is simple to implement, satisfies the conservation property and can be used for two-dimensional sediment transport problems in non-homogeneous isotropic beds without need of complicated three-dimensional equations. To assess the performance of the proposed models, we present numerical results for a wide variety of shallow water flows over sedimentary layers. Comparisons to experimental data for dam-break problems over movable beds are also included in this study. © 2020 Elsevier Inc.","2020","2024-11-21 21:06:48","2024-11-21 21:48:47","","474 – 497","","","88","","","","","","","","","","English","","","","","","","Publisher: Elsevier Inc. Type: Article","","","","2D; Characteristics method; Conservation properties; Equations of motion; Flow of water; FVC; Hydraulics; Method of characteristics; Multilayers; Numerical Method; Numerical methods; Projection techniques; Sediment transport; Sedimentology; Suspended sediments; SWE-Exner; Three-dimensional equations; Two-dimensional modelling; Two-dimensional shallow water equations; Two-dimensional transport equation","","","","","","","","","","","","","","","","","","","","","","","","","","","","","","","","","","","","","","","","","","","","","","",""
"ZNT36E99","journalArticle","2015","Liu, Xin; Mohammadian, Abdolmajid; Kurganov, Alexander; Infante Sedano, Julio Angel","Well-balanced central-upwind scheme for a fully coupled shallow water system modeling flows over erodible bed","Journal of Computational Physics","","00219991","10.1016/j.jcp.2015.07.043","https://www.scopus.com/inward/record.uri?eid=2-s2.0-84939436275&doi=10.1016%2fj.jcp.2015.07.043&partnerID=40&md5=bdfd6628dfe13be306c0ca419004c3fc","Intense sediment transport and rapid bed evolution are frequently observed under highly-energetic flows, and bed erosion sometimes is of the same magnitude as the flow itself. Simultaneous simulation of multiple physical processes requires a fully coupled system to achieve an accurate hydraulic and morphodynamical prediction. In this paper, we develop a high-order well-balanced finite-volume method for a new fully coupled two-dimensional hyperbolic system consisting of the shallow water equations with friction terms coupled with the equations modeling the sediment transport and bed evolution.The nonequilibrium sediment transport equation is used to predict the sediment concentration variation. Since bed-load, sediment entrainment and deposition have significant effects on the bed evolution, an Exner-based equation is adopted together with the Grass bed-load formula and sediment entrainment and deposition models to calculate the morphological process. The resulting 5. ×. 5 hyperbolic system of balance laws is numerically solved using a Godunov-type central-upwind scheme on a triangular grid. A computationally expensive process of finding all of the eigenvalues of the Jacobian matrices is avoided: The upper/lower bounds on the largest/smallest local speeds of propagation are estimated using the Lagrange theorem. A special discretization of the bed-slope term is proposed to guarantee the well-balanced property of the designed scheme. The proposed fully coupled model is verified on a number of numerical experiments. © 2015 Elsevier Inc.","2015","2024-11-21 21:06:48","2024-11-21 21:49:26","","202 – 218","","","300","","","","","","","","","","English","","","","","","","Publisher: Academic Press Inc. Type: Article","","","","2D; Bed evolutions; Central-upwind scheme; Dam-break flow; Eigenvalues and eigenfunctions; Equations of motion; Finite volume method; Finite-volume method; Fully coupled shallow water system; Fully-coupled; FVM; Jacobian matrices; Lagrange multipliers; Lagrange theorem; Lagrange's theorems; Numerical Method; Sediment transport; Sedimentation; Shallow-water systems; SWE-Exner; Well balanced; Well-balanced central-upwind scheme","","","","","","","","","","","","","","","","","","","","","","","","","","","","","","","","","","","","","","","","","","","","","","",""
"8DENTT4Z","journalArticle","2010","Murillo, J.; García-Navarro, P.","An Exner-based coupled model for two-dimensional transient flow over erodible bed","Journal of Computational Physics","","00219991","10.1016/j.jcp.2010.08.006","https://www.scopus.com/inward/record.uri?eid=2-s2.0-77956920338&doi=10.1016%2fj.jcp.2010.08.006&partnerID=40&md5=4944ae4feb147cd1a7e7213ffcca34a9","Transient flow over erodible bed is solved in this work assuming that the dynamics of the bed load problem is described by two mathematical models: the hydrodynamic model, assumed to be well formulated by means of the depth averaged shallow water equations, and the Exner equation. The Exner equation is written assuming that bed load transport is governed by a power law of the flow velocity and by a flow/sediment interaction parameter variable in time and space. The complete system is formed by four coupled partial differential equations and a genuinely Roe-type first order scheme has been used to solve it on triangular unstructured meshes. Exact solutions have been derived for the particular case of initial value Riemann problems with variable bed level and depending on particular forms of the solid discharge formula. The model, supplied with the corresponding solid transport formulae, is tested by comparing with the exact solutions. The model is validated against laboratory experimental data of different unsteady problems over erodible bed. © 2010 Elsevier Inc.","2010","2024-11-21 21:06:48","2024-11-21 21:49:43","","8704 – 8732","","23","229","","","","","","","","","","English","","","","","","","Publisher: Academic Press Inc. Type: Article","","","","2D; 2d weak solution; 2D weak solutions; Bank equilibrium; Bed load sediment transport; Bedload sediment transport; Equations of motion; Erodible beds; Exn equation; Exner equation; Finite volume method; Finite-volume method; Flow velocity; FVM; Numerical Method; Roe method; Roe's methods; Sediment transport; shallow flow; shallow flows; Shallow water; Shallow Water; Shallow Water Equations; Shallow waters; surface flow; SWE; SWE-Exner; Transient flow; Weak solution","","","","","","","","","","","","","","","","","","","","","","","","","","","","","","","","","","","","","","","","","","","","","","",""
"EW5J87YQ","journalArticle","2021","Uh Zapata, Miguel; Gamboa Salazar, Lucia; Itzá Balam, Reymundo; Nguyen, Kim Dan","An unstructured finite-volume semi-coupled projection model for bed load sediment transport in shallow-water flows","Journal of Hydraulic Research","","00221686","10.1080/00221686.2020.1786740","https://www.scopus.com/inward/record.uri?eid=2-s2.0-85095749122&doi=10.1080%2f00221686.2020.1786740&partnerID=40&md5=ff8a0216a0a75ce4c26681b05d089f6c","The aim of this work is to develop an original semi-coupled approach for solving the Saint-Venant and Exner equation system. The shallow-water equations are solved first to calculate the full evolution of flow fields, and then the Exner equation is solved to model the morphodynamic response. The numerical method is based on a projection method, which consists in combining the momentum and continuity equations in order to establish a Poisson-type equation for water surface levels. The present formulation is identified as a semi-coupled approach because the projection method incorporates the change in the bed evolution in its approximation. A second-order numerical scheme has been proposed using an unstructured finite-volume technique and an implicit time integration method. Several benchmarks are used to demonstrate the capabilities, accuracy and performance of the model. © 2020 International Association for Hydro-Environment Engineering and Research.","2021","2024-11-21 21:06:48","2024-11-21 21:48:41","","545 – 558","","4","59","","","","","","","","","","English","","","","","","","Publisher: Taylor and Francis Ltd. Type: Article","","","","2D; bedload; Benchmarking; Continuity equations; Equations of motion; finite volume method; Finite volume technique; flow field; FVM; Implicit time integration; model; Morphodynamic response; numerical method; Numerical Method; Numerical methods; Poisson equation; Projection method; Projection models; sediment transport; Sediment transport; shallow water; Shallow water equations; Shallow water flow; SWE-Exner; water flow","","","","","","","","","","","","","","","","","","","","","","","","","","","","","","","","","","","","","","","","","","","","","","",""
"VJT84T5I","journalArticle","2019","Dazzi, S.; Vacondio, R.; Mignosa, P.","Integration of a Levee Breach Erosion Model in a GPU-Accelerated 2D Shallow Water Equations Code","WATER RESOURCES RESEARCH","","0043-1397","10.1029/2018WR023826","","This paper presents a two-dimensional shallow water equations code coupled with a physically based erosion model, able to predict the opening and evolution of breaches forming in levees built with either cohesive or noncohesive material. The bottom elevation change is evaluated using an excess shear-stress equation, which accounts for the hydrodynamic conditions and for the material characteristics. The proposed model modifies the local topography at runtime wherever the levee is overtopped without having to predefine the position and shape of the breach. The model is implemented in CUDA programming language, so that simulations can be run on graphics processing units, guaranteeing fast execution times even for high-resolution meshes and large domains. The validation is performed based on several experimental tests, and numerical predictions are in good agreement with the measurements. The strengths and weaknesses of the proposed approach are also discussed by comparison with a sediment transport model based on the Exner equation: While the latter gives good results only for breaches forming in levees built with noncohesive material, the proposed model can also be applied to cohesive embankments. The application to a historical flood event is also presented, showing that the model can effectively be employed for real field simulations also in the case of multiple breaches.","2019-01","2024-11-21 21:26:47","2024-11-21 21:49:18","","682-702","","1","55","","","","","","","","","","English","","","","","","","Place: 2000 FLORIDA AVE NW, WASHINGTON, DC 20009 USA Publisher: AMER GEOPHYSICAL UNION Type: Article","","","","2D; 2D shallow water equations; Computer graphics; computer simulation; CUDA; Embankments; Equations of motion; erosion; Erosion; experimental study; finite volume; finite volume method; Finite volume method; flood; flood simulation; Flood simulation; Floods; FVM; GPU; Graphics processing unit; hardware; historical perspective; levee; levee breach; Levee breaches; Levees; Material characteristics; Numerical Method; Physically-based erosion model; Program processors; sediment transport; Sediment transport; Sediment transport model; shallow water equations; Shallow water equations; shallow-water equation; Shear stress; software; SWE-Exner; topography; Two-dimensional shallow water equations","","","","","","","","","","","","","","","","","","","","","","","","","","","","","","","","","","","","","","","","","","","","","","",""
