"MH5EFW9A","journalArticle","2014","Juez, C.; Murillo, J.; García-Navarro, P.","A 2D weakly-coupled and efficient numerical model for transient shallow flow and movable bed","Advances in Water Resources","","03091708","10.1016/j.advwatres.2014.05.014","https://www.scopus.com/inward/record.uri?eid=2-s2.0-84903436292&doi=10.1016%2fj.advwatres.2014.05.014&partnerID=40&md5=25e98ee7eaeafcecbc94447b517d78e6","Recent advances in the simulation of free surface flows over mobile bed have shown that accurate and stable results in realistic problems can be provided if an appropriate coupling between the shallow water equations (SWE) and the Exner equation is performed. This coupling can be done if using a suitable Jacobian matrix. As a result, faithful numerical predictions are available for a wide range of flow conditions and empirical bed load discharge formulations, allowing to investigate the best option in each case study, which is mandatory in these type of environmental problems. When coupling the equations, the SWE are considered but including an extra conservation law for the sediment dynamics. In this way the computational cost may become unrealistic in situations where the application of the SWE over rigid bed can be used involving large time and space scales without giving up to the adequate level of mesh refinement. Therefore, for restoring the numerical efficiency, the coupling technique is simplified, not decreasing the number of waves involved in the Riemann problem but simplifying their definitions. The effects of the approximations made are tested against experimental data which include transient problems over erodible bed. The simplified model is formulated under a general framework able to insert any desirable discharge solid load formula. © 2014 Elsevier Ltd.","2014","2024-11-21 21:06:48","2024-11-21 21:06:48","","93 – 109","","","71","","","","","","","","","","English","","","","","","","Publisher: Elsevier Ltd Type: Review","","","","2D shallow waters; Bed load; bedload; Concrete placing; Coupling techniques; discharge; Environmental problems; Equations of motion; Exner equation; finite volume method; Finite volume method; flow modeling; Jacobian matrices; Numerical efficiency; numerical model; Numerical predictions; sediment transport; Sediment transport; Shallow water equations; shallow-water equation; spatiotemporal analysis; two-dimensional flow; water flow","","","","","","","","","","","","","","","","","","","","","","","","","","","","","","","","","","","","","","","","","","","","","","",""
"SMD8EQXK","journalArticle","2019","Barzgaran, Mina; Mahdizadeh, Hossein; Sharifi, Soroosh","Numerical simulation of bedload sediment transport with the ability to model wet/dry interfaces using an augmented Riemann solver","Journal of Hydroinformatics","","14647141","10.2166/hydro.2019.046","https://www.scopus.com/inward/record.uri?eid=2-s2.0-85073065634&doi=10.2166%2fhydro.2019.046&partnerID=40&md5=1577634e8a7ff0b90b980f92cdb40b96","This paper presents an efficient second-order finite volume method for the simulation of bedload sediment transport which is capable of modeling wet/dry fronts. The governing equations comprise the shallow water equations (SWEs) for the hydrodynamic phase and the Exner equation for the estimation of bedload sediment transport. These sets of equations are then solved using a weakly coupled scheme based on an augmented Riemann solver (WCAR). In this approach, first, the morphodynamic equation is solved, and then, updated bedload changes with the same Riemann structures are used as a source term within the SWEs. The Smart formula is utilized to estimate the bedload sediment discharge within the Exner equation. The proposed numerical model is first used to model a parabolic sediment layer. Then, a bedload hump propagation with an initial subcritical condition is considered. Next, the simulation of dam-break flow over a mobile bed is investigated. Finally, the dam failure due to over-topping is studied and the computed results are compared with available experimental data. Numerical results indicate that the introduced weakly coupled method, developed based upon the augmented Riemann solver, can be effectively used for modeling all investigated flow regimes, including dry-state interfaces. © IWA Publishing 2019","2019","2024-11-21 21:06:48","2024-11-21 21:06:48","","834 – 850","","5","21","","","","","","","","","","English","","","","","","","Publisher: IWA Publishing Type: Article","","","","","","","","","","","","","","","","","","","","","","","","","","","","","","","","","","","","","","","","","","","","","","","","","","",""
"42H34SD4","journalArticle","2013","Michoski, C.; Dawson, C.; Mirabito, C.; Kubatko, E.J.; Wirasaet, D.; Westerink, J.J.","Fully coupled methods for multiphase morphodynamics","Advances in Water Resources","","03091708","10.1016/j.advwatres.2013.05.002","https://www.scopus.com/inward/record.uri?eid=2-s2.0-84879534433&doi=10.1016%2fj.advwatres.2013.05.002&partnerID=40&md5=aba3d932d8b5a907768679dd61dc32a2","We present numerical methods for a system of equations consisting of the two dimensional Saint-Venant shallow water equations (SWEs) fully coupled to a completely generalized Exner formulation of hydrodynamically driven sediment discharge. This formulation is implemented by way of a discontinuous Galerkin (DG) finite element method, using a Roe Flux for the advective components and the unified form for the dissipative components. We implement a number of Runge-Kutta time integrators, including a family of strong stability preserving (SSP) schemes, and Runge-Kutta Chebyshev (RKC) methods. A brief discussion is provided regarding implementational details for generalizable computer algebra tokenization using arbitrary algebraic fluxes. We then run numerical experiments to show standard convergence rates, and discuss important mathematical and numerical nuances that arise due to prominent features in the coupled system, such as the emergence of nondifferentiable and sharp zero crossing functions, radii of convergence in manufactured solutions, and nonconservative product (NCP) formalisms. Finally we present a challenging application model concerning hydrothermal venting across metalliferous muds in the presence of chemical reactions occurring in low pH environments. © 2013.","2013","2024-11-21 21:06:48","2024-11-21 21:06:48","","95 – 110","","","59","","","","","","","","","","English","","","","","","","Type: Article","","","","Algebra; Discontinuous galerkin; equation; Equations of motion; finite element method; Functions; Galerkin method; Galerkin methods; Geophysical flows; geophysics; Hot springs; hydrodynamics; hydrothermal vent; Hydrothermal vent; morphodynamics; Morphodynamics; multiphase flow; numerical method; numerical model; Runge Kutta methods; sediment transport; Sediment transport; Shallow waters; shallow-water equation","","","","","","","","","","","","","","","","","","","","","","","","","","","","","","","","","","","","","","","","","","","","","","",""
"Z46Z9DNZ","journalArticle","2019","Dazzi, S.; Vacondio, R.; Mignosa, P.","Integration of a Levee Breach Erosion Model in a GPU-Accelerated 2D Shallow Water Equations Code","Water Resources Research","","00431397","10.1029/2018WR023826","https://www.scopus.com/inward/record.uri?eid=2-s2.0-85060759441&doi=10.1029%2f2018WR023826&partnerID=40&md5=5eac9e792d72a444fd2554964dd49ef9","This paper presents a two-dimensional shallow water equations code coupled with a physically based erosion model, able to predict the opening and evolution of breaches forming in levees built with either cohesive or noncohesive material. The bottom elevation change is evaluated using an excess shear-stress equation, which accounts for the hydrodynamic conditions and for the material characteristics. The proposed model modifies the local topography at runtime wherever the levee is overtopped without having to predefine the position and shape of the breach. The model is implemented in CUDA programming language, so that simulations can be run on graphics processing units, guaranteeing fast execution times even for high-resolution meshes and large domains. The validation is performed based on several experimental tests, and numerical predictions are in good agreement with the measurements. The strengths and weaknesses of the proposed approach are also discussed by comparison with a sediment transport model based on the Exner equation: While the latter gives good results only for breaches forming in levees built with noncohesive material, the proposed model can also be applied to cohesive embankments. The application to a historical flood event is also presented, showing that the model can effectively be employed for real field simulations also in the case of multiple breaches. ©2019. American Geophysical Union. All Rights Reserved.","2019","2024-11-21 21:06:48","2024-11-21 21:06:48","","682 – 702","","1","55","","","","","","","","","","English","","","","","","","Publisher: Blackwell Publishing Ltd Type: Article","","","","2D shallow water equations; Computer graphics; computer simulation; Embankments; Equations of motion; Erosion; experimental study; finite volume method; Finite volume method; flood; Flood simulation; Floods; Graphics processing unit; hardware; historical perspective; levee; Levee breaches; Levees; Material characteristics; Physically-based erosion model; Program processors; sediment transport; Sediment transport; Sediment transport model; Shallow water equations; shallow-water equation; Shear stress; software; topography; Two-dimensional shallow water equations","","","","","","","","","","","","","","","","","","","","","","","","","","","","","","","","","","","","","","","","","","","","","","",""
"37CHL47U","journalArticle","2013","Juez, Carmelo; Murillo, Javier; García-Navarro, Pilar","Numerical assessment of bed-load discharge formulations for transient flow in 1D and 2D situations","Journal of Hydroinformatics","","14647141","10.2166/hydro.2013.153","https://www.scopus.com/inward/record.uri?eid=2-s2.0-84891780357&doi=10.2166%2fhydro.2013.153&partnerID=40&md5=3b890b3b6103f1297d341161d66d3551","Two-dimensional (2D) transient flow over an erodible bed can be modelled using shallow-water equations and the Exner equation to describe the morphological evolution of the bed. Considering the fact that well-proven capacity formulae are based on one-dimensional (1D) experimental steady flows, the assessment of these empirical relations under unsteady 1D and 2D situations is important. In order to ensure the reliability of the numerical experimentation, the formulation has to be general enough to allow the use of different empirical laws. Moreover, the numerical scheme must handle correctly the coupling between the 2D shallow-water equations and the Exner equation under any condition. In this work, a finite-volume numerical scheme that includes these two main features will be exploited here in 1D and 2D laboratory test cases. The relative performances of Meyer-Peter and Müller, Ashida and Michiue, Engelund and Fredsoe, Fernandez Luque and Van Beek, Parker, Smart, Nielsen, Wong and Camenen and Larson formulations are analysed in terms of the root mean square error. A new discretization of the Smart formula is provided, leading to promising predictions of the erosion/deposition rates. The results arising from this work are useful to justify the use of an empirical sediment bed-load discharge formula among the ones studied, regardless of the hydrodynamic situation. © IWA Publishing 2013.","2013","2024-11-21 21:06:48","2024-11-21 21:06:48","","1234 – 1257","","4","15","","","","","","","","","","English","","","","","","","Publisher: IWA Publishing Type: Conference paper","","","","","","","","","","","","","","","","","","","","","","","","","","","","","","","","","","","","","","","","","","","","","","","","","","",""
"GWWWIGRY","journalArticle","2023","Duan, Jennifer G.; Yu, Chunshui; Ding, Yan","Numerical Simulation of Sediment Transport in Unsteady Open Channel Flow","Water (Switzerland)","","20734441","10.3390/w15142576","https://www.scopus.com/inward/record.uri?eid=2-s2.0-85166238094&doi=10.3390%2fw15142576&partnerID=40&md5=883556245aa8a009de382e76fba300ce","This paper presented a two-dimensional, well-balanced hydrodynamic and sediment transport model based on the solutions of variable-density shallow-water equations (VDSWEs) and the Exner equation for bed change for simulating sediment transport in unsteady flows. Those equations are solved in a coupled way by the first-order Godunov-type finite volume method. The Harten–Lax–van Leer–Contact (HLLC) Riemann solver is extended to find the local Riemann fluxes to maintain the exact balance between the momentum term and the bed slope term. A well-balanced scheme is superior to an unbalanced scheme to minimize numerical dispersion as demonstrated by the synthetic standing contact-discontinuity test case. Following this, the model is employed to simulate two laboratory experiments and a field case, the 1996 Lake Ha! Ha! flood event in Canada. The results of water surface elevations and bed surface profiles agree well with the measurements. The accuracy and robustness of the numerical schemes make the model a good candidate for practical engineering applications. © 2023 by the authors.","2023","2024-11-21 21:06:48","2024-11-21 21:06:48","","","","14","15","","","","","","","","","","English","","","","","","","Publisher: Multidisciplinary Digital Publishing Institute (MDPI) Type: Article","","","","Balanced property; Canada; Dam-break flow; dispersion; Equations of motion; Finite volume method; Finite-volume method; flood; Floods; Godunov-type finite volume method; Harten–lax–van leer–contact riemann solv; Non-equilibrium sediment transport; Nonequilibrium sediment transport model; Numerical methods; open channel flow; Open channel flow; Riemann solver; sediment transport; Sediment transport; Sediment transport modelling; Sedimentation; Shallow water equations; shallow-water equation; unsteady flow; Variable density; Variable density shallow water equation; Well balanced; Well-balanced property","","","","","","","","","","","","","","","","","","","","","","","","","","","","","","","","","","","","","","","","","","","","","","",""
"6KZULFBM","journalArticle","2017","Zhao, Jia-heng; Özgen, Ilhan; Liang, Dong-fang; Hinkelmann, Reinhard","Comparison of depth-averaged concentration and bed load flux sediment transport models of dam-break flow","Water Science and Engineering","","16742370","10.1016/j.wse.2017.12.006","https://www.scopus.com/inward/record.uri?eid=2-s2.0-85040000611&doi=10.1016%2fj.wse.2017.12.006&partnerID=40&md5=95a06cb6c2f5bd813deb2d9fdabe27f5","This paper presents numerical simulations of dam-break flow over a movable bed. Two different mathematical models were compared: a fully coupled formulation of shallow water equations with erosion and deposition terms (a depth-averaged concentration flux model), and shallow water equations with a fully coupled Exner equation (a bed load flux model). Both models were discretized using the cell-centered finite volume method, and a second-order Godunov-type scheme was used to solve the equations. The numerical flux was calculated using a Harten, Lax, and van Leer approximate Riemann solver with the contact wave restored (HLLC). A novel slope source term treatment that considers the density change was introduced to the depth-averaged concentration flux model to obtain higher-order accuracy. A source term that accounts for the sediment flux was added to the bed load flux model to reflect the influence of sediment movement on the momentum of the water. In a one-dimensional test case, a sensitivity study on different model parameters was carried out. For the depth-averaged concentration flux model, Manning's coefficient and sediment porosity values showed an almost linear relationship with the bottom change, and for the bed load flux model, the sediment porosity was identified as the most sensitive parameter. The capabilities and limitations of both model concepts are demonstrated in a benchmark experimental test case dealing with dam-break flow over variable bed topography. © 2017 Hohai University","2017","2024-11-21 21:06:48","2024-11-21 21:06:48","","287 – 294","","4","10","","","","","","","","","","English","","","","","","","Publisher: Editorial Office of Water Science and Engineering Type: Article","","","","Approximate Riemann solver; Computational fluid dynamics; Dam-breaks; Dams; Equations of motion; Erosion and deposition; Finite volume method; Flux model; Manning's coefficients; Porosity; Sediment transport; Sediment transport model; Sedimentation; Sediments; Shallow water equations; Shallow waters","","","","","","","","","","","","","","","","","","","","","","","","","","","","","","","","","","","","","","","","","","","","","","",""
"3LU96QWI","journalArticle","2013","Wang, J.Y.; Tang, H.S.; Fang, H.W.","A fully coupled method for simulation of wave-current-seabed systems","Communications in Nonlinear Science and Numerical Simulation","","10075704","10.1016/j.cnsns.2012.11.005","https://www.scopus.com/inward/record.uri?eid=2-s2.0-84873571081&doi=10.1016%2fj.cnsns.2012.11.005&partnerID=40&md5=0f2388ee8508efdb8e7e318ad85aac31","Coastal flow involves surface wave propagation, current circulation, and seabed evolution, and its prediction remains challenging when they strongly interact with each other, especially during extreme events such as tsunami and storm surge. We propose a fully coupled method to simulate motion of wave-current-seabed systems and associated multiphysics phenomena. The wave action equation, the shallow water equations, and the Exner equation are respectively used for wave, current, and seabed morphology, and the discretization is based on a second-order, flux-limiter, finite difference scheme previously developed for current-seabed systems. The proposed method is tested with analytical solutions, laboratory measurements, and numerical solutions obtained with other schemes. Its advantages are demonstrated in capturing interplay among wave, current, and seabed; it has the capability of first-order upwind schemes to suppress artificial oscillations as well as the accuracy of second-order schemes in resolving flow structures. © 2012 Elsevier B.V.","2013","2024-11-21 21:06:48","2024-11-21 21:06:48","","1694 – 1709","","7","18","","","","","","","","","","English","","","","","","","Publisher: Elsevier B.V. Type: Article","","","","'current; Coastal flow; Coupled method; Dam-breaks; Equations of motion; Finite difference method; Flux limiters; Fully-coupled; Model coupling; Numerical methods; Sand dunes; Surface waves; Wave current; Wave propagation; Wave-current-seabed system","","","","","","","","","","","","","","","","","","","","","","","","","","","","","","","","","","","","","","","","","","","","","","",""
"6E38VN5J","journalArticle","2020","Rowan, Thomas; Seaid, Mohammed","Efficient computational models for shallow water flows over multilayer erodible beds","Engineering Computations (Swansea, Wales)","","02644401","10.1108/EC-10-2018-0470","https://www.scopus.com/inward/record.uri?eid=2-s2.0-85072103312&doi=10.1108%2fEC-10-2018-0470&partnerID=40&md5=ebcb20be9550ad6a1e98056632fdd9d0","Purpose: The purpose of this paper is to present a new numerical model for shallow water flows over heterogeneous sedimentary layers. It is already several years since the single-layered models have been used to model shallow water flows over erodible beds. Although such models present a real opportunity for shallow water flows over movable beds, this paper is the first to propose a multilayered solver for this class of flow problems. Design/methodology/approach: Multilayered beds formed with different erodible soils are considered in this study. The governing equations consist of the well-established shallow water equations for the flow, a transport equation for the suspended sediments, an Exner-type equation for the bed load and a set of empirical equations for erosion and deposition terms. For the numerical solution of the coupled system, the authors consider a non-homogeneous Riemann solver equipped with interface-tracking tools to resolve discontinuous soil properties in the multilayered bed. The solver consists of a predictor stage for the discretization of gradient terms and a corrector stage for the treatment of source terms. Findings: This paper reveals that modeling shallow water flows over multilayered sedimentary topography can be achieved by using a coupled system of partial differential equations governing sediment transport. The obtained results demonstrate that the proposed numerical model preserves the conservation property, and it provides accurate results, avoiding numerical oscillations and numerical dissipation in the approximated solutions. Originality/value: A novel implementation of sediment handling is presented where both averaged and separate values for sediment species are used to ensure speed and precision in the simulations. © 2019, Emerald Publishing Limited.","2020","2024-11-21 21:06:48","2024-11-21 21:06:48","","401 – 429","","2","37","","","","","","","","","","English","","","","","","","Publisher: Emerald Group Holdings Ltd. Type: Article","","","","Approximated solutions; Conservation properties; Design/methodology/approach; Equations of motion; Erosion and deposition; Finite volume method; Flow of water; Hydraulics; Numerical models; Riemann solver; Sediment transport; Sedimentary layers; Sedimentology; Shallow water equations; Shallow water flow; Suspended sediments; Topography","","","","","","","","","","","","","","","","","","","","","","","","","","","","","","","","","","","","","","","","","","","","","","",""
"W4XNPDSA","journalArticle","2023","González-Aguirre, J.C.; González-Vázquez, J.A.; Alavez-Ramírez, J.; Silva, R.; Vázquez-Cendón, M.E.","Numerical Simulation of Bed Load and Suspended Load Sediment Transport Using Well-Balanced Numerical Schemes","Communications on Applied Mathematics and Computation","","20966385","10.1007/s42967-021-00162-1","https://www.scopus.com/inward/record.uri?eid=2-s2.0-85132377829&doi=10.1007%2fs42967-021-00162-1&partnerID=40&md5=9bbec9619f48f39a546f8f37f0fb244c","Sediment transport can be modelled using hydrodynamic models based on shallow water equations coupled with the sediment concentration conservation equation and the bed conservation equation. The complete system of equations is made up of the energy balance law and the Exner equations. The numerical solution for this complete system is done in a segregated manner. First, the hyperbolic part of the system of balance laws is solved using a finite volume scheme. Three ways to compute the numerical flux have been considered, the Q-scheme of van Leer, the HLLCS approximate Riemann solver, and the last one takes into account the presence of non-conservative products in the model. The discretisation of the source terms is carried out according to the numerical flux chosen. In the second stage, the bed conservation equation is solved by using the approximation computed for the system of balance laws. The numerical schemes have been validated making comparisons between the obtained numerical results and the experimental data for some physical experiments. The numerical results show a good agreement with the experimental data. © 2021, Shanghai University.","2023","2024-11-21 21:06:48","2024-11-21 21:06:48","","885 – 922","","2","5","","","","","","","","","","English","","","","","","","Publisher: Springer Type: Article","","","","Balance law; Bed load; Complete system; Conservation equations; Equations of motion; Finite volume method; Finite-volume method; Numerical flux; Numerical methods; Numerical models; Numerical results; Numerical scheme; Sediment transport; Sedimentation; Suspended loads; Suspended sediments; Well- balanced schemes","","","","","","","","","","","","","","","","","","","","","","","","","","","","","","","","","","","","","","","","","","","","","","",""